{
  "schema_version": "controlled-contract-admitted-proof-pack.v2",
  "profile_id": "proof.policy.declared-limit-propagation",
  "profile_version": "2.0.0",
  "profile_digest": "2a20c114f8dd9fcf5b41cfa9d514d9fd1b36e789eb0fa25eb38dbdc1778d4684",
  "guarantee": "For one exact closed declared policy and one exact raw UTF-8 guidance artifact, the package-owned transformer associates every required policy key with exactly one plain decimal value and exact unit token, refuses missing, duplicate, stale, conflicting, substituted, wrong-unit, and unrelated-number guidance, and emits complete policy-key and association populations, exact counts, associations, and one canonical report bound to the exact source-set digest.",
  "guarantee_digest": "5892b6dbb347a027318369b35707d59b1e5cd9be14731d3862eee02e2e7736af",
  "explicit_exclusions": [
    "additional-live-guidance-surfaces-beyond-the-one-captured-artifact",
    "artifact-acquisition-completeness-before-exact-capture",
    "declared-policy-document-correspondence-to-enforced-limit-and-unit",
    "evidence-authority-applicability-authority-or-cce-consequences",
    "guidance-propagation-does-not-entail-boundary-consistency",
    "locally-redigested-or-unadmitted-profile-variants",
    "non-plain-decimal-numeral-forms",
    "runtime-truth-or-production-enforcement",
    "shared-policy-identity-across-independently-assessed-packs"
  ],
  "certification": {
    "method": "executable_semantic_adequacy",
    "adequacy_declaration_digest": "c154721ef817be16d42446b232ed8bb22ae014d34fff20ba5ff8f9ce86546012",
    "adequacy_result_digest": "dd617df89406a07d9420522b5f521bba63f4ceac26b97d525ce61b6b54252e71",
    "executable_control_count": 25,
    "negative_fixture_count": 0,
    "coverage_witness_count": 0
  }
}
