{
  "schema_version": "controlled-contract-admitted-proof-pack.v2",
  "profile_id": "proof.authentication.direct-source-provenance",
  "profile_version": "2.0.0",
  "profile_digest": "0b9b62d09bc5d01b743b5f8fa895fe9729fe05037863ec33f6fe46d6bbb1c42c",
  "guarantee": "For one exact directly captured evidence occurrence E, target T, provenance source S, and observation attempt A, the captured evidence bytes authenticate T during A, E originates from S during A, T has S as its singular source of record during A, E was observed in A, the selected target and source populations are complete singletons, and four independent verification claims with exact controlled-complement falsifiers verify those same-occurrence behaviors.",
  "guarantee_digest": "4f01a730acc440a7b32445445b8119e3f2a70f868bf3563fefbbee327b45eb81",
  "explicit_exclusions": [
    "authorship-issuance-or-authorization",
    "caller-honesty-or-source-discovery-completeness",
    "derived-copied-or-transformed-evidence",
    "freshness-beyond-the-bound-observation-attempt",
    "generic-integrity-or-runtime-truth",
    "ownership-containment-or-decision-authority",
    "provenance-outside-the-complete-selected-source-population",
    "runtime-evidence-cce-or-publication-authority"
  ],
  "certification": {
    "method": "executable_adequacy_full_negative_corpus",
    "adequacy_declaration_digest": "4a22908bb312e1cdc07c8bd8d6db4845c478d3ff2ee275e65c0c3e97f1f7b3cb",
    "adequacy_result_digest": "97ae233036522a7ffad07c258c8c0d3319c0569edd7b7760d4bc6195697ff79e",
    "executable_control_count": 75,
    "negative_fixture_count": 1,
    "coverage_witness_count": 74
  }
}
