{
  "schema_version": "controlled-contract-admitted-proof-pack.v2",
  "profile_id": "proof.pagination.complete-traversal",
  "profile_version": "2.0.0",
  "profile_digest": "4b8c3738b3b35c31f4a9d5c09aff3ecd12557d5c30f8bc0f972084351abab54f",
  "guarantee": "For one exact package-authenticated authoritative ordered-occurrence population and exact captured finite pagination trace, every occurrence is returned exactly once in authoritative order through one canonical initial state, one linear opaque cursor chain, one snapshot/version identity, and one terminal page, with equality-normalized completeness and fail-closed resource accounting.",
  "guarantee_digest": "c5ad980aa18bc912f1364789e814675e45343e85f3ebf56702f932b357323414",
  "explicit_exclusions": [
    "caller-declared-population-completeness",
    "cas-linearizability",
    "cross-contract-result-join",
    "cross-pack-result-join",
    "runtime-truth",
    "snapshot-acquisition-atomicity",
    "traversal-liveness",
    "unrepresented-concurrency"
  ],
  "certification": {
    "method": "executable_adequacy_full_negative_corpus",
    "adequacy_declaration_digest": "32766d247aa2574cff7ceda712b72e2d7fc46f83bcfb0ac5f68f78134c820821",
    "adequacy_result_digest": "afcaa34420cb14ab61092706972134e5685c2d70bdb1034b691a5c52daefd54b",
    "executable_control_count": 49,
    "negative_fixture_count": 0,
    "coverage_witness_count": 33
  }
}
