{
  "schema_version": "controlled-contract-admitted-proof-pack.v2",
  "profile_id": "proof.compatibility.behavioral-preservation",
  "profile_version": "3.0.0",
  "profile_digest": "2f27cf03a3c80536e129710da66cd72a4b931a752fd27a51e449ed573841c3e2",
  "guarantee": "For one declared logical behavior source, two distinct baseline and candidate behavior-report artifacts expose equal complete populations of typed observable descriptors by mutual subset, bind one shared exact nonnegative observable count, emit count signals equal to that count, and expose one explicitly selected canonical observable-value pair that is exactly equal. One verification reads both full reports and each verified equality has its controlled complement as a separate falsifier. Exact-bound admission additionally requires two distinct caller-selected source descriptors for the full report artifacts whose complete captured bytes have the same SHA-256.",
  "guarantee_digest": "85c6d4e5fd97c4cb01ad7fc5f81d15b7519d174eb130895291118e5c69947ae8",
  "explicit_exclusions": [
    "applicability-selection",
    "automatic-or-arbitrary-multi-value-pairing",
    "behavior-outside-the-two-captured-reports",
    "business-semantics-referential-integrity-and-cross-observable-invariants",
    "caller-authored-observable-population-truthfulness-and-completeness",
    "captured-report-construction-canonicalization-and-provenance",
    "delivered-test-execution-and-result-authenticity",
    "field-name-schema-or-semantic-mapping",
    "logical-behavior-source-provenance",
    "nondeterminism-timing-ordering-and-side-effects-not-encoded-in-the-reports",
    "runtime-behavior-beyond-the-captured-observation-point",
    "type-coercion-normalization-unit-conversion-rounding-or-timezone-conversion",
    "typed-observable-descriptor-authoritative-construction-or-existence"
  ],
  "certification": {
    "method": "executable_adequacy_full_negative_corpus",
    "adequacy_declaration_digest": "e5483a07234b44e81f6ddd27edff755650afe29baaa07ade4e98aae459c91d1f",
    "adequacy_result_digest": "fde09a29350cb1eea1dbc939e0167410ca0e8cead57afbe6b89f659d24c04dbc",
    "executable_control_count": 41,
    "negative_fixture_count": 87,
    "coverage_witness_count": 87
  }
}
