{
  "schema_version": "controlled-contract-admitted-proof-pack.v2",
  "profile_id": "proof.input.caller-authority-confinement",
  "profile_version": "1.0.0",
  "profile_digest": "dcee54896ee91383b92b5f0ba2e7013475bfa7e146750519278f78c6c4266135",
  "guarantee": "For one exact closed canonical caller-input policy, one exact accepted request and parser attempt, one distinct exact authority-bearing forbidden request and parser attempt, and one authenticated complete ordered observation cut ending at that forbidden attempt's exact refusal, the package-owned combined projection exactly partitions declared members, derives typed structural identities and all member-to-coordinate-to-operation-to-effect associations, proves the accepted opaque path-like control selects no coordinate and is accepted, proves the forbidden member is refused, exactly reconciles the policy-derived source census, and establishes no resolver, loader, filesystem, environment, module, catalog, subprocess, return, or success occurrence for the forbidden attempt before refusal.",
  "guarantee_digest": "c1223d3646244ecd972d854b9e5243b2e756d63b638be031aa90b4ba449bcc5c",
  "explicit_exclusions": [
    "canonical-policy-adapter-fidelity-outside-capture",
    "cce-consequences-or-publication-authority",
    "cross-pack-occurrence-joins",
    "instrumentation-completeness-outside-policy-derived-source-census",
    "post-refusal-behavior-and-later-requests",
    "runtime-truth-beyond-exact-capture"
  ],
  "certification": {
    "method": "executable_semantic_adequacy",
    "adequacy_declaration_digest": "cc9bf90ef5de31787436bbb91faaef3ed6a9054edc583d0359de366286e251b1",
    "adequacy_result_digest": "9e67d3bb018f46fc655aa2cb5d8e9929fc02122edbc5a7bb60ca1198d572bfbc",
    "executable_control_count": 85,
    "negative_fixture_count": 0,
    "coverage_witness_count": 0
  }
}
